{
  "contract": "aralearn.contract",
  "version": 4,
  "kind": "project",
  "courses": [
    {
      "id": "course-fixture-minimal",
      "title": "Fixture Minimal",
      "goal": "Validar o contrato v4 com um exemplo curto.",
      "modules": [
        {
          "id": "module-fixture-minimal",
          "title": "Módulo",
          "guide": {
            "goal": "Cobrir um único conceito.",
            "include": [
              "conjunção"
            ],
            "exclude": [
              "predicados"
            ],
            "notation": [
              "Use P e Q."
            ],
            "avoid": [
              "Não abrir outro tópico."
            ]
          },
          "lessons": [
            {
              "id": "lesson-fixture-minimal",
              "title": "Lição",
              "guide": {
                "goal": "Explicar a conjunção.",
                "include": [
                  "conjunção"
                ],
                "exclude": [
                  "predicados"
                ],
                "notation": [
                  "Use P e Q."
                ],
                "avoid": [
                  "Não abrir outro tópico."
                ]
              },
              "topics": [
                {
                  "id": "topic-conjuncao",
                  "label": "conjunção",
                  "kind": "concept",
                  "checks": [
                    "o aluno reconhece a regra central"
                  ],
                  "errors": [
                    "confundir com disjunção"
                  ]
                }
              ],
              "microsequences": [
                {
                  "id": "micro-fixture-minimal",
                  "title": "Regra central",
                  "goal": "Reconhecer a linha verdadeira da conjunção.",
                  "role": "explain",
                  "status": "ready",
                  "dependsOn": [],
                  "covers": [
                    "conjunção"
                  ],
                  "checks": [
                    "o aluno reconhece a linha verdadeira"
                  ],
                  "cards": [
                    {
                      "id": "card-fixture-minimal-regra",
                      "position": 1,
                      "resource": "paragraph",
                      "kind": "theory",
                      "exercise": "none",
                      "title": "Regra central",
                      "text": "A conjunção só é verdadeira quando as duas proposições são verdadeiras.",
                      "after": "Se uma delas for falsa, a conjunção inteira é falsa."
                    },
                    {
                      "id": "card-fixture-minimal-complete",
                      "position": 2,
                      "resource": "paragraph",
                      "kind": "exercise",
                      "exercise": "gap",
                      "title": "Complete",
                      "text": "A conjunção é verdadeira quando [[as duas são verdadeiras::as duas são verdadeiras|só P é verdadeira|só Q é verdadeira]].",
                      "after": "As duas partes precisam ser verdadeiras."
                    }
                  ]
                }
              ]
            }
          ]
        }
      ]
    }
  ]
}
