{
  "contract": "aralearn.contract",
  "version": 4,
  "kind": "project",
  "courses": [
    {
      "id": "course-graph-example",
      "title": "Graph Example",
      "goal": "Mostrar o recurso graph no contrato v4.",
      "modules": [
        {
          "id": "module-graph-example",
          "title": "Grafo",
          "guide": {
            "goal": "Cobrir um grafo simples.",
            "include": [
              "graph"
            ],
            "exclude": [],
            "notation": [
              "Use rótulos concisos."
            ],
            "avoid": [
              "Não depender de contexto externo."
            ]
          },
          "lessons": [
            {
              "id": "lesson-graph-example",
              "title": "Grafo simples",
              "guide": {
                "goal": "Ler um grafo de dois vértices.",
                "include": [
                  "graph"
                ],
                "exclude": [],
                "notation": [
                  "Use rótulos concisos."
                ],
                "avoid": [
                  "Não depender de contexto externo."
                ]
              },
              "topics": [],
              "microsequences": [
                {
                  "id": "micro-graph-example",
                  "title": "Aresta única",
                  "goal": "Reconhecer a ligação entre A e B.",
                  "role": "explain",
                  "status": "ready",
                  "dependsOn": [],
                  "covers": [
                    "graph"
                  ],
                  "checks": [
                    "o aluno identifica a aresta destacada"
                  ],
                  "cards": [
                    {
                      "id": "card-graph-example-1",
                      "position": 1,
                      "resource": "graph",
                      "kind": "theory",
                      "exercise": "none",
                      "title": "Ligação A-B",
                      "prompt": "Observe a aresta destacada.",
                      "vertices": [
                        {
                          "id": "A",
                          "label": "A"
                        },
                        {
                          "id": "B",
                          "label": "B"
                        }
                      ],
                      "edges": [
                        {
                          "from": "A",
                          "to": "B",
                          "label": "liga",
                          "weight": "1",
                          "id": "edge-1"
                        }
                      ],
                      "highlight": {
                        "vertices": [
                          "A"
                        ],
                        "edges": [
                          "edge-1"
                        ]
                      },
                      "after": "A ligação destacada conecta `A` a `B`.",
                      "layout": "path"
                    }
                  ]
                }
              ]
            }
          ]
        }
      ]
    }
  ]
}
